{
  "$schema": "https://json-schema.org/draft/2020-12/schema",
  "$id": "https://xcodebuildmcp.com/schemas/structured-output/xcodebuildmcp.output.test-result/2.schema.json",
  "type": "object",
  "additionalProperties": false,
  "allOf": [
    {
      "$ref": "https://xcodebuildmcp.com/schemas/structured-output/_defs/common.schema.json#/$defs/errorConsistency"
    }
  ],
  "properties": {
    "schema": {
      "const": "xcodebuildmcp.output.test-result"
    },
    "schemaVersion": {
      "const": "2"
    },
    "didError": {
      "type": "boolean"
    },
    "error": {
      "type": [
        "string",
        "null"
      ]
    },
    "data": {
      "type": "object",
      "additionalProperties": false,
      "properties": {
        "request": {
          "$ref": "https://xcodebuildmcp.com/schemas/structured-output/_defs/common.schema.json#/$defs/buildInvocationRequest"
        },
        "summary": {
          "type": "object",
          "additionalProperties": false,
          "properties": {
            "status": {
              "enum": [
                "SUCCEEDED",
                "FAILED"
              ]
            },
            "durationMs": {
              "type": "integer",
              "minimum": 0
            },
            "target": {
              "enum": [
                "simulator",
                "device",
                "macos",
                "swift-package"
              ]
            },
            "counts": {
              "$ref": "https://xcodebuildmcp.com/schemas/structured-output/_defs/common.schema.json#/$defs/counts"
            }
          },
          "required": [
            "status"
          ]
        },
        "artifacts": {
          "type": "object",
          "additionalProperties": false,
          "properties": {
            "deviceId": {
              "type": "string"
            },
            "buildLogPath": {
              "type": "string"
            },
            "packagePath": {
              "type": "string"
            },
            "xcresultPath": {
              "type": "string"
            }
          },
          "required": [],
          "minProperties": 1
        },
        "diagnostics": {
          "$ref": "https://xcodebuildmcp.com/schemas/structured-output/_defs/common.schema.json#/$defs/testDiagnostics"
        },
        "tests": {
          "type": "object",
          "additionalProperties": false,
          "properties": {
            "selected": {
              "type": "array",
              "items": {
                "type": "string"
              }
            },
            "discovered": {
              "type": "object",
              "additionalProperties": false,
              "properties": {
                "total": {
                  "type": "integer",
                  "minimum": 0
                },
                "items": {
                  "type": "array",
                  "items": {
                    "type": "string"
                  }
                }
              },
              "required": [
                "total",
                "items"
              ]
            }
          },
          "required": []
        },
        "testCases": {
          "type": "array",
          "items": {
            "type": "object",
            "additionalProperties": false,
            "properties": {
              "suite": {
                "type": "string"
              },
              "test": {
                "type": "string"
              },
              "status": {
                "enum": [
                  "passed",
                  "failed",
                  "skipped"
                ]
              },
              "durationMs": {
                "type": "integer",
                "minimum": 0
              }
            },
            "required": [
              "test",
              "status"
            ]
          }
        }
      },
      "required": [
        "summary",
        "artifacts",
        "diagnostics"
      ]
    },
    "nextSteps": {
      "$ref": "https://xcodebuildmcp.com/schemas/structured-output/_defs/common.schema.json#/$defs/nextSteps"
    }
  },
  "required": [
    "schema",
    "schemaVersion",
    "didError",
    "error",
    "data"
  ]
}
