{
  "schema": "xcodebuildmcp.output.test-result",
  "schemaVersion": "2",
  "didError": false,
  "error": null,
  "data": {
    "summary": {
      "status": "SUCCEEDED",
      "durationMs": 1234,
      "counts": {
        "passed": 1,
        "failed": 0,
        "skipped": 0
      },
      "target": "simulator"
    },
    "artifacts": {
      "buildLogPath": "~/Library/Developer/XcodeBuildMCP/workspaces/XcodeBuildMCP-<HASH>/logs/test_sim_<TIMESTAMP>_pid<PID>.log",
      "xcresultPath": "~/Library/Developer/XcodeBuildMCP/workspaces/XcodeBuildMCP-<HASH>/result-bundles/test_sim_<TIMESTAMP>_pid<PID>.xcresult"
    },
    "tests": {
      "selected": [
        "CalculatorAppTests/CalculatorAppTests/testAddition"
      ],
      "discovered": {
        "total": 1,
        "items": [
          "CalculatorAppTests/CalculatorAppTests/testAddition"
        ]
      }
    },
    "diagnostics": {
      "warnings": [],
      "errors": [],
      "testFailures": []
    },
    "testCases": [
      {
        "suite": "CalculatorAppTests",
        "test": "testAddition",
        "status": "passed",
        "durationMs": 0
      }
    ]
  }
}
