{
  "schema": "xcodebuildmcp.output.test-result",
  "schemaVersion": "2",
  "didError": false,
  "error": null,
  "data": {
    "request": {
      "scheme": "spm",
      "configuration": "debug",
      "platform": "Swift Package",
      "target": "swift-package"
    },
    "summary": {
      "status": "SUCCEEDED",
      "durationMs": 1234,
      "counts": {
        "passed": 1,
        "failed": 0,
        "skipped": 0
      },
      "target": "swift-package"
    },
    "artifacts": {
      "buildLogPath": "~/Library/Developer/XcodeBuildMCP/workspaces/XcodeBuildMCP-<HASH>/logs/swift_package_test_<TIMESTAMP>_pid<PID>.log"
    },
    "diagnostics": {
      "warnings": [],
      "errors": [],
      "testFailures": []
    },
    "testCases": [
      {
        "test": "Basic truth assertions",
        "status": "passed",
        "durationMs": 0
      }
    ]
  }
}
